article_author,article_date,article_location,body,title,url,Publié le 25 juin 2020 à 19h00, Afrique du Sud ,"Pour ne rien manquer de l’actualité africaine, inscrivez-vous à la newsletter du « Monde Afrique » depuis ce lien. Chaque samedi à 6 heures, retrouvez une semaine d’actualité et de débats traitée par la rédaction du « Monde Afrique ».","En Afrique du Sud, la galère des étrangers au temps du coronavirus",https://www.lemonde.fr/afrique/article/2020/06/25/en-afrique-du-sud-la-galere-des-etrangers-au-temps-du-coronavirus_6044193_3212.html
Olivier Faye,"Publié hier à 22h03, mis à jour à 01h07", Le Havre ,"La cravate rouge de Jean-Paul Lecoq n’y aura pas suffi. Le candidat communiste à la mairie du Havre a baladé son accessoire toute la journée, dimanche 28 juin, pour que les électeurs le reconnaissent, malgré le masque sur son visage. Mais c’est bien Edouard Philippe, auréolé de son statut de « rockstar », comme dit un observateur local, celui de chef de gouvernement en première ligne lors de la crise due au coronavirus, qui l’a emporté, avec 58,8 % des voix, contre 41,2 % pour son adversaire. Une victoire que l’ancien juppéiste a savourée, malgré le contexte morose au niveau national pour la majorité et alors que sa place à Matignon reste en sursis.","Municipales : incertain sur son avenir, Edouard Philippe savoure sa victoire au Havre",https://www.lemonde.fr/politique/article/2020/06/28/municipales-incertain-sur-son-avenir-edouard-philippe-savoure-sa-victoire-au-havre_6044480_823448.html
,Publié le 14 mars 2020 à 10h00 - Mis à jour le 27 juin 2020 à 12h13, Arts et loisirs ,"Réalisé aux États-Unis, ce test a été initialement publié en anglais sur le site Wirecutter. Vous pouvez le lire ici en version originale. ",,https://www.lemonde.fr/guides-d-achat/article/2020/03/14/les-meilleurs-jumelles-pour-l-observation-la-randonnee-ou-l-ornithologie_6033061_5306571.html
,Publié aujourd’hui à 01h14, Planète ,"Tous les signaux écologiques sont au rouge et ils deviennent même incandescents. Le climat se réchauffe de plus en plus vite ; de récentes révélations des chercheurs du centre de renommée internationale Stockholm Resilient Center montrent que le rôle des nuages sur le changement climatique avait été sous-estimé et que l’objectif de 1,5 °C pourtant mentionné par l’accord de Paris est d’ores et déjà hors de portée. Les limites planétaires sont en grande partie dépassées, la biodiversité est menacée, la déforestation continue à nous rendre plus vulnérables aux pandémies zoonotiques comme celle du Covid-19 que nous venons de vivre.",,https://www.lemonde.fr/idees/article/2020/06/29/marie-toussaint-assez-de-tergiversations-il-faut-un-referendum-pour-interdire-enfin-l-ecocide_6044489_3232.html
,Publié le 27 juin 2020 à 06h00, Vie quotidienne ,"L’affaire Adama Traoré a montré que les expertises réalisées à la demande des parties civiles et à leurs frais pouvaient totalement contredire celles qui sont ordonnées par les juges. En matière civile aussi, il peut y avoir contradiction entre les expertises judiciaires ordonnées par le juge et les expertises amiables payées, le plus souvent, par l’une des parties. Que valent ces dernières ?",,https://www.lemonde.fr/argent/article/2020/06/27/expert-judiciaire-ou-expert-amiable-auquel-faut-il-faire-appel_6044370_1657007.html
Les Décodeurs,"Publié hier à 12h22, mis à jour hier à 17h15", Municipales 2020 : enjeux et résultats ,"Trois mois et demi après le premier tour des élections municipales, 16 millions d’électeurs et d’électrices sont appelés aux urnes dans près de 5 000 communes pour désigner leur équipe municipale. Au premier tour, qui s’est déroulé le 15 mars à l’avant-veille du confinement, la participation a été plus faible que les années précédentes.",Municipales 2020 : participation en forte baisse par rapport aux années précedentes,https://www.lemonde.fr/les-decodeurs/article/2020/06/28/municipales-2020-la-participation-en-baisse-par-rapport-au-premier-tour_6044454_4355770.html
,,,"Pour la cinquième année consécutive, Le Monde décerne ses Prix de l’innovation urbaine-« Le Monde » Cities. Soixante et un projets ont été soumis au jury par un comité de sélection composé de personnalités du monde entier, experts des mutations urbaines : élus, chercheurs, dirigeants d’entreprise ou de fondations, architectes, urbanistes…","Au Burkina Faso, l’association La Voûte nubienne ressuscite une technique de construction ancestrale et écologique",https://www.lemonde.fr/afrique/article/2020/06/25/au-burkina-faso-l-association-la-voute-nubienne-ressuscite-une-technique-de-construction-ancestrale-et-ecologique_6044110_3212.html
Benjamin Barthe,Publié le 26 juin 2020 à 11h11 - Mis à jour le 26 juin 2020 à 11h35, Proche-Orient ,"C’est le genre de dilemme dont les Etats arabes se passeraient bien, mais auquel ils ont dû s’habituer ces dernières années du fait de l’unilatéralisme israélo-américain. Après la reconnaissance par Washington de Jérusalem comme capitale de l’Etat hébreu en 2017, puis la reconnaissance, toujours par la Maison Blanche, de l’annexion du Golan par Israël en 2019 et, enfin, l’annonce du plan de paix de Donald Trump en janvier, la possibilité que le gouvernement israélien annexe à partir du 1er juillet une partie de la Cisjordanie place les capitales arabes une nouvelle fois en porte-à-faux.",Embarras arabe sur le projet d’annexion d’Israël en Cisjordanie,https://www.lemonde.fr/international/article/2020/06/26/embarras-arabe-sur-le-projet-d-annexion-en-cisjordanie_6044265_3210.html
,Publié le 26 juin 2020 à 23h56 - Mis à jour le 27 juin 2020 à 05h50, Les envies du « Monde » ,LA LISTE DE LA MATINALE,"Tendre, musical, social ou sportif : nos replays du week-end",https://www.lemonde.fr/televisions-radio/article/2020/06/26/tendre-musical-social-ou-sportif-nos-replays-du-week-end_6044349_1655027.html
Cécile Peltier,"Publié le 26 juin 2020 à 12h45, mis à jour hier à 06h07",,"Foyer de propagation du nouveau coronavirus, en raison de sa « densité », la ville s’est aussi imposée, à travers ses infrastructures et ses réseaux de solidarité, comme un laboratoire d’expérimentation. Le respect des règles de distanciation physique l’a poussée à imaginer des solutions pour adapter son espace public au développement de la marche et du vélo ou à structurer des circuits courts pour soutenir ses commerçants ou ses maraîchers.",Les sept piliers de la sagesse urbaine dans le « monde d’après »,https://www.lemonde.fr/smart-cities/article/2020/06/26/les-sept-piliers-de-la-sagesse-urbaine-dans-le-monde-d-apres_6044285_4811534.html
Hervé Morin,Publié le 20 juin 2020 à 17h53 - Mis à jour le 26 juin 2020 à 11h19, Coronavirus et pandémie de Covid-19 ,"Richard Horton est une figure incontournable de l’édition scientifique. Patron depuis un quart de siècle du journal médical britannique The Lancet, il vient de publier un ouvrage dans lequel il dénonce la faillite des exécutifs occidentaux face à la pandémie (The COVID-19 Catastrophe : What’s Gone Wrong and How to Stop It Happening Again, Polity, non traduit).","Richard Horton, patron du « Lancet » : « Le Covid-19 montre une faillite catastrophique des gouvernements occidentaux »",https://www.lemonde.fr/sciences/article/2020/06/20/richard-horton-le-covid-19-montre-une-faillite-catastrophique-des-gouvernements-occidentaux_6043590_1650684.html
,Publié le 25 juin 2020 à 15h17 - Mis à jour le 25 juin 2020 à 17h53,,"Tribune. Depuis mardi, l’Europe traverse sa première vague de chaleur de l’été. En ville, ce type d’épisode météorologique renforce un phénomène particulier : les îlots de chaleur urbains. Ces derniers se caractérisent par une augmentation plus importante de la température dans les espaces denses, tels que les centres-villes, par rapport aux espaces qui le sont moins.",,https://www.lemonde.fr/smart-cities/article/2020/06/25/la-lutte-contre-les-ilots-de-chaleur-urbains-est-loin-d-etre-gagnee_6044162_4811534.html
,Publié le 23 juin 2020 à 18h30 - Mis à jour le 25 juin 2020 à 14h43, Intelligence artificielle ,"Carte blanche. La crise sanitaire du Covid-19 est un champ d’exploration et d’investigation pour les algorithmes d’intelligence artificielle (IA) dans différents secteurs comme l’épidémiologie, l’imagerie médicale, les essais cliniques. Les bénéfices sont nombreux. Grâce à l’analyse des images scanner pulmonaires et aux prédictions qui en résultent, on peut détecter les lésions, les quantifier et lever les ambiguïtés diagnostiques dues au manque de fiabilité du test RT-PCR. L’IA permet la prédiction de l’évolution de la gravité des lésions pour optimiser le parcours patient et la gestion des lits de réanimation en temps de crise. Les données – leur disponibilité, leur exploitabilité et leur interprétabilité – sont la clé de voûte de ces études. Certaines initiatives sont en cours pour une coordination sur un partage au niveau européen ou français, via le Health Data Hub, afin de faciliter l’interopérabilité des sources de données hétérogènes multisites et leurs alignements.",,https://www.lemonde.fr/sciences/article/2020/06/23/les-failles-multiples-revelees-par-le-lancetgate-mettent-en-lumiere-l-urgence-d-une-ia-responsable_6043927_1650684.html
,"Publié hier à 15h23, mis à jour hier à 18h38", Coronavirus et pandémie de Covid-19 ,"Dix millions de cas du nouveau coronavirus ont officiellement été diagnostiqués à travers le monde dimanche 28 juin, selon un comptage réalisé par l’Agence France-Presse. Parmi ces cas, 498 779 décès ont été recensés, notamment en Europe, continent le plus touché (2 637 546 cas et 195 975 décès), ainsi qu’aux Etats-Unis (2 510 323 cas, dont 125 539 décès), pays le plus touché.",Coronavirus : le nombre de cas déclarés dans le monde dépasse les 10 millions,https://www.lemonde.fr/planete/article/2020/06/28/coronavirus-le-nombre-de-cas-declares-dans-le-monde-a-double-depuis-le-21-mai_6044461_3244.html
Martin Untersinger,Publié le 24 juin 2020 à 22h56 - Mis à jour le 26 juin 2020 à 16h45, Maroc ,"Le journaliste d’investigation marocain Omar Radi est sorti, jeudi 25 juin, des locaux de la brigade nationale de la police judiciaire marocaine après plusieurs heures d’interrogatoire.",Maroc : le journaliste d’investigation Omar Radi longuement interrogé par la police,https://www.lemonde.fr/pixels/article/2020/06/24/maroc-le-journaliste-d-investigation-omar-radi-convoque-par-la-police_6044074_4408996.html
Laurent Carpentier,Publié le 24 juin 2020 à 09h00 - Mis à jour le 24 juin 2020 à 19h22, Scènes ,"J’ai obtenu une consultation à 18 heures avec Mathilde Charbonneaux. Après avoir échangé sur la façon dont j’ai vécu le confinement, elle m’a délivré une prescription : « Joue le jeu. Menace le travail encore plus. Ne sois pas le personnage principal. Cherche la confrontation. Mais n’aie pas d’intention. Evite les arrière-pensées. Ne tais rien. Sois doux et fort… » Un extrait de Par les villages (1981), de Peter Handke, dont la jeune femme en blouse blanche se met à dire un long passage puisé dans son « Vidal de poésie ». Car Mathilde Charbonneaux est comédienne.","Au Théâtre de la Ville à Paris, la poésie comme pied de nez à la mort",https://www.lemonde.fr/culture/article/2020/06/24/theatre-la-poesie-comme-pied-de-nez-a-la-mort_6043980_3246.html
Camille Labro,Publié le 19 juin 2020 à 12h00, Recettes légères ,"600 g de filets de maigre avec la peau (ou lieu, chinchard, daurade, bar…)",Le carpaccio de poisson : la recette d’Anne Etorre,https://www.lemonde.fr/les-recettes-du-monde/article/2020/06/19/le-carpaccio-de-poisson-la-recette-d-anne-etorre_6043426_5324493.html
Frédéric Potet,Publié le 25 juin 2020 à 16h47 - Mis à jour le 26 juin 2020 à 11h32, Tours ,"Vingt mille nouveaux arbres, pour l’un ; 30 000 pour l’autre. Quarante kilomètres de pistes cyclables supplémentaires, ici ; cinq « autoroutes à vélo », là. Mais aussi – tout cumulé – des centaines de jardins familiaux, des dizaines de mini-forêts urbaines, une unité de production hydroélectrique, des hôtels à insectes, des fermes pédagogiques, des tonnes de légumes bio dans les cantines, n’en jetez plus ! Une fièvre verte s’est abattue sur Tours, à la faveur des élections municipales.","A Tours, la fièvre verte s’empare des candidats aux municipales",https://www.lemonde.fr/politique/article/2020/06/25/a-tours-la-fievre-verte-s-empare-des-candidats-aux-municipales_6044176_823448.html
,Publié le 12 juin 2020 à 07h00, Le goût de M ,"Jean Touitou est le nouvel invité du podcast Le Goût de M proposé par M Le magazine du Monde. Le fondateur de la marque A.P.C. a répondu depuis son appartement du 7e arrondissement parisien aux questions de la journaliste et productrice Géraldine Sarratia. Jean Touitou y évoque son enfance en Tunisie, son goût de la musique, de la lumière ; son départ pour la France alors que commence la décolonisation ; sa découverte du design sous influence d’un père qui travaille dans le cuir. Dans les années 1960, il se passionne pour Bob Dylan, Samuel Beckett, Guy Debord, se lie avec André, le fils de l’éditeur Jérôme Lindon, et intègre l’Organisation communiste internationaliste. La décennie suivante, il abandonne la révolution par « lassitude », voyage puis intègre Kenzo avant de fonder quelques années plus tard A.P.C. Il décrit l’ambition qu’il avait pour la mode, son rejet de l’esthétique des années 1980 et son acceptation progressive de la laideur. Il décrypte pour finir le goût de l’époque – la célébrité, l’emballage, le marketing –, constate l’absence d’approche radicale et aborde, le temps d’une anecdote savoureuse, son amitié avec le rappeur Kanye West.","Jean Touitou : « La mode, ça devient une science dure »",https://www.lemonde.fr/podcasts/article/2020/06/12/jean-touitou-la-mode-ca-devient-une-science-dure_6042587_5463015.html
Camille Labro,Publié le 29 mai 2020 à 12h00, Desserts ,"Pour la pâte brisée : 170 g de farine T65, 30 g de farine de sarrasin, 100 g de beurre à température ambiante, 1 petit verre d’eau, 1 pincée de sel, 1 c. à s. de graines de lin (optionnel).",La tarte aux fraises : la recette de Fanny Giansetto,https://www.lemonde.fr/les-recettes-du-monde/article/2020/05/29/la-tarte-aux-fraises-la-recette-de-fanny-giansetto_6041173_5324493.html
,,,"L’arrêt de bus est à peine visible, dans un virage face à un gros cube blanc, une improbable salle de bridge du centre de Wimbledon, banlieue aisée du sud de Londres. « C’est là qu’il m’a craché dessus il y a quinze jours », nous signale Spencer, le chauffeur, mains gantées sur le volant. Il nous a embarqués pour sa dernière tournée de la journée, celle de 13 h 30-15 h 30, dans le bus 200. On a un peu de mal à l’entendre à cause du bruit du moteur et de la distanciation physique à respecter (2 mètres). Il manœuvre déjà son engin, un coup d’œil à droite, un à gauche, attention aux cyclistes qui grillent le rouge, aux voitures qui déboulent bien au-delà des 20 miles/heure (32 km/h) autorisés.","Pendant le coronavirus, les conducteurs de bus londoniens ont travaillé la peur au ventre",https://www.lemonde.fr/m-le-mag/article/2020/06/26/pendant-le-coronavirus-les-conducteurs-bus-londoniens-ont-travaille-la-peur-au-ventre_6044300_4500055.html
Pierre Gervasoni,Publié le 24 juin 2020 à 17h21, Musiques ,"Lundi 25 mai, une tribune annonçant la création d’une Fédération de compositeurs était publiée sur le site Internet de La Lettre du musicien, accompagnée de la liste des 170 noms déjà acquis à cette entreprise qui témoigne de rapprochements inattendus. Karol Beffa et Pascal Dusapin apparaissent en effet sous une même bannière alors qu’en 2013, à la suite d’une conférence controversée au Collège de France, ils étaient considérés comme les pires ennemis du Tout-Paris de la création. « Ils ont été ravis ! », assure Benoît Menut, un des deux initiateurs du projet de Fédération, avant d’ajouter que « d’autres ont été plus difficiles à convaincre ».",Les compositeurs de musique de divers horizons se fédèrent,https://www.lemonde.fr/culture/article/2020/06/24/les-compositeurs-de-musique-de-divers-horizons-se-federent_6044040_3246.html
,,,"« Nous allons pouvoir tourner la page du premier acte, en quelque sorte, de la crise que nous venons de traverser. » Dans une allocution télévisée, Emmanuel Macron a donné dimanche 14 juin le coup d’envoi d’un déconfinement quasi généralisé de la France, et une nouvelle séries d’assouplissements ont été annoncés à partir du 22 juin.","Le déconfinement s’accélère : restos, frontières, cinémas, écoles… quelles restrictions restent en vigueur après le 22 juin ?",https://www.lemonde.fr/les-decodeurs/article/2020/05/28/phase-2-du-deconfinement-lycees-restos-cinemas-salles-de-sport-ce-qui-peut-rouvrir-et-ce-qui-restera-ferme_6041094_4355770.html
,Publié le 16 juin 2020 à 12h49 - Mis à jour le 16 juin 2020 à 13h09, Pandémie ,"L’Etat a-t-il les moyens de la transition écologique ? Alors qu’Emmanuel Macron affirme que la relance sera écologique, de quels leviers dispose vraiment le gouvernement pour s’assurer que la relance de l’économie n’entraînera pas une augmentation des gaz à effet de serre ? Entre la carotte des aides financières et le bâton des réglementations et des normes, Nabil Wakim et Marie Charrel nous expliquent les moyens d’action des pouvoirs publics.",Climat : l’Etat peut-il vraiment transformer l’économie ?,https://www.lemonde.fr/podcasts/article/2020/06/16/climat-l-etat-peut-il-vraiment-transformer-l-economie_6043034_5463015.html
Marion Douet,Publié le 25 juin 2020 à 13h00, Kenya ,"Pour ne rien manquer de l’actualité africaine, inscrivez-vous à la newsletter du « Monde Afrique » depuis ce lien. Chaque samedi à 6 heures, retrouvez une semaine d’actualité et de débats traitée par la rédaction du « Monde Afrique ».","Au Kenya, le Covid-19 fait reculer la lutte contre les mutilations sexuelles",https://www.lemonde.fr/afrique/article/2020/06/25/au-kenya-le-covid-19-fait-reculer-la-lutte-contre-les-mutilations-sexuelles_6044155_3212.html
,Publié le 27 juin 2020 à 00h46 - Mis à jour le 27 juin 2020 à 00h48, Maroc ,"Les autorités marocaines ont « réfuté catégoriquement », vendredi 26 juin, les « allégations infondées » d’Amnesty International, selon qui le Maroc a piraté le téléphone du journaliste Omar Radi avec un logiciel espion.",Le Maroc dément l’espionnage du journaliste Omar Radi,https://www.lemonde.fr/afrique/article/2020/06/27/le-maroc-dement-l-espionnage-du-journaliste-omar-radi_6044351_3212.html
Hélène Jouan,"Publié le 27 juin 2020 à 11h42, mis à jour hier à 21h56", Canada ,"Le premier ministre canadien persiste et signe : il a répété jeudi 25 juin qu’il n’était pas question de s’immiscer dans le processus d’extradition en cours concernant la directrice financière de Huawei, Meng Wanzhou, quand bien même une intervention gouvernementale faciliterait la libération des deux ressortissants canadiens détenus par la Chine depuis plus de cinq cents jours.",Affaire Meng : Justin Trudeau refuse de céder à la pression,https://www.lemonde.fr/international/article/2020/06/27/affaire-meng-justin-trudeau-refuse-de-ceder-a-la-pression_6044394_3210.html
Patrick Roger,"Publié hier à 18h05, mis à jour hier à 19h21", Municipales 2020 : tous nos articles ,"Conformément à ce que prédisaient plusieurs instituts de sondage, la participation au second tour des élections municipales, dimanche 28 juin, devrait afficher un nouveau recul par rapport au niveau historiquement bas qui avait été enregistré au premier tour, le 15 mars : 44,6 %. Les estimations la situent entre 40 % et 41 %. Au second tour des élections municipales de 2014, la participation avait atteint 62,13 % des électeurs inscrits.",Elections municipales : un nouveau recul de la participation inquiétant,https://www.lemonde.fr/politique/article/2020/06/28/un-nouveau-recul-de-l-abstention-inquietant_6044467_823448.html
Joan Tilouine,Publié aujourd’hui à 00h26, Médias ,"Depuis un an, dans le centre-ville de Ouagadougou, au Burkina Faso, les salariés de Canal+ se rendent au bureau avec une seule crainte, celle de revivre l’épisode traumatisant du 23 mai 2019. Ce jour-là, un huissier de justice débarque dans leurs locaux accompagné de gendarmes armés de kalachnikovs et de civils arborant un tee-shirt appelant à voter pour le Congrès pour la démocratie et le progrès (CDP), dont le candidat à l’élection présidentielle de novembre est Eddie Komboïgo. Le commando se rend au cinquième étage et pille tout ce que les bureaux contiennent d’ordinateurs, de chaises et d’imprimantes.",Canal+ pris dans un étau judiciaire au Burkina Faso,https://www.lemonde.fr/afrique/article/2020/06/29/canal-pris-dans-un-etau-judiciaire-au-burkina-faso_6044486_3212.html
Martin Untersinger,Publié le 23 juin 2020 à 17h06 - Mis à jour le 24 juin 2020 à 09h31, Appli StopCovid ,"Trois semaines après son déploiement en France, l’application StopCovid n’a, pour le moment, pas été cruciale dans l’identification de potentiels malades du Covid-19 sur le territoire : c’est ce qu’indiquent les chiffres présentés mardi 23 juin à la presse par le secrétaire d’Etat au numérique, Cédric O, qui a piloté le projet né pendant le confinement.","Après trois semaines, l’application StopCovid n’a averti que 14 personnes",https://www.lemonde.fr/pixels/article/2020/06/23/application-stopcovid-14-personnes-averties-en-trois-semaines_6043915_4408996.html
,"Publié le 26 juin 2020 à 00h10, mis à jour hier à 14h36", Les envies du « Monde » ,LA LISTE DE LA MATINALE,"De 2000 à 2016, six spectacles d’Avignon à voir ou à revoir",https://www.lemonde.fr/culture/article/2020/06/26/de-2000-a-2016-sept-spectacles-d-avignon-a-voir-ou-a-revoir_6044209_3246.html
Clément Guillou,"Publié le 27 juin 2020 à 09h54, mis à jour hier à 06h13", Tourisme ,"Ces derniers temps, à Dubrovnik (Croatie), ils sont partout. Se prélassent à l’ombre des maisons de pierre, trottinent le soir sur le marbre blanc et deviennent bruyants la nuit.","« A la fois fantastique et étrange », Dubrovnik, en Croatie, vidée de ses touristes",https://www.lemonde.fr/economie/article/2020/06/27/a-la-fois-fantastique-et-etrange-dubrovnik-en-croatie-videe-de-ses-touristes_6044385_3234.html
Adrien Pécout,Publié le 26 juin 2020 à 17h49 - Mis à jour le 26 juin 2020 à 19h29, Sport et société ,"Pierre de Coubertin est pour l’instant seul, mais plus pour très longtemps. Le baron, père des Jeux olympiques (JO) modernes, se dresse déjà – à travers un monument en bronze – dans le hall du Comité national olympique et sportif français (CNOSF). Le bâtiment parisien s’apprête à ouvrir bientôt ses portes à une autre figure, plus méconnue : d’après nos informations, le CNOSF projette d’inaugurer en 2021 une sculpture en l’honneur d’Alice Milliat.  Le projet, quoique tardif, veut rendre hommage à l’une des précurseuses du sport au féminin : à la fois pratiquante (aviron, en particulier) et présidente d’un club omnisports, le Fémina Sport (1915) ; cofondatrice de la Fédération des sociétés féminines sportives de France (1917) ; puis créatrice des Jeux mondiaux féminins à Paris, en 1922, deux ans avant les JO (à Paris également), où les femmes représentaient seulement 4 % des participants…","Une sculpture en hommage à Alice Milliat, pionnière du sport féminin",https://www.lemonde.fr/sport/article/2020/06/26/une-statue-en-hommage-a-alice-milliat-pionniere-du-sport-feminin_6044324_3242.html
Francis Marmande,Publié le 24 juin 2020 à 16h50 - Mis à jour le 25 juin 2020 à 11h12, Musiques ,"Vingt-huit ans après Vol pour Sidney (aller), le producteur Jean Rochard publie sur son label nato (nato en minuscules, précise-t-il depuis 1981), Vol pour Sidney (retour). « Pourquoi 28 ans ? C’est le temps qu’il faut pour réfléchir à ce que l’on fait », dit Rochard… Et le label nato fait tout à l’envers, réunissant ses collectifs de musiciennes, musiciens et techniciens, dans un esprit plus anarchiste qu’anarchique, mais surtout, gaiement acharniste.",Jazz : envolée de reprises pour Sidney Bechet,https://www.lemonde.fr/culture/article/2020/06/24/jazz-envolee-de-reprises-pour-sidney-bechet_6044036_3246.html
