article_author,article_date,article_location,body,title,url
,"Publié le 19 février 2020 à 14h26, mis à jour hier à 22h44", Municipales 2020 : tous nos articles ,"La candidate de gauche Michèle Rubirola compte près de dix points d'avance sur ses adversaires à Marseille, selon des estimations d'Harris Interactive. Sa liste est arrivée en première position (39,9 %) devant celle de la candidate LR Martine Vassal (29,8 %), celle du candidat RN Stéphane Ravier (19,8 %), celle de Bruno Gilles (dissident LR, 6,2 %), celle de Samia Ghali (divers gauche, 2,7 %) et celle d'Yvon Berland (LREM-UDI, 1,6 %).

Médecin de profession, l'écologiste à la tête du ""Printemps marseillais"" avait créé la surprise en arrivant en tête au premier tour des élections municipales, devant la candidate Les Républicains Martine Vassal.",Municipales 2020 : les résultats à Marseille,https://www.lemonde.fr/les-decodeurs/article/2020/02/19/qui-sont-les-candidats-qui-se-presentent-a-marseille-pour-les-municipales-2020_6030101_4355770.html
,Publié le 01 juillet 2019 à 10h19,,"Le Monde a remis, vendredi 28 juin à Ground Control, à Paris, les prix Le Monde Cities de l’innovation urbaine. Cent onze projets ont été soumis au jury par un comité de sélection composé de 28 personnalités du monde entier, experts des mutations urbaines : élus, chercheurs, dirigeants d’entreprise ou de fondations, architectes, urbanistes…",« Le Monde » a décerné cinq prix de l’innovation urbaine,https://www.lemonde.fr/smart-cities/article/2019/07/01/le-monde-a-decerne-cinq-prix-de-l-innovation-urbaine_5483685_4811534.html
Guy Dutheil,Publié le 26 juin 2020 à 03h05 - Mis à jour le 26 juin 2020 à 10h45, Transports ,"Après trois mois de fermeture pour cause de crise sanitaire, Orly a rouvert ses portes, vendredi 26 juin. Mais l’aéroport du sud de la banlieue parisienne ne se prépare pas à accueillir des flots de passagers. Il ne devrait en voir passer « que 8 000 par jour contre 80 000 à 100 000 » d’ordinaire à cette période de l’année, note Edward Arkwright, directeur général exécutif de Groupe ADP, gestionnaire des aéroports d’Orly, de Roissy-Charles-de-Gaulle et du Bourget.","Après trois mois d’arrêt, un premier avion a décollé de l’aéroport d’Orly",https://www.lemonde.fr/economie/article/2020/06/26/covid-19-le-deconfinement-d-orly-se-fait-a-pas-comptes_6044221_3234.html
Guy Dutheil,Publié le 27 juin 2020 à 09h35 - Mis à jour le 27 juin 2020 à 10h30, Transports ,"Voici venu le temps des mauvaises nouvelles pour Air France. A l’arrêt ou presque pendant plusieurs semaines, la compagnie, qui a obtenu 7 milliards d’euros de prêts garantis par l’Etat, s’apprête à tailler dans ses effectifs. La direction veut supprimer entre 8 000 et 10 000 postes. Interrogée, celle-ci n’a pas souhaité commenter ces chiffres. Benjamin Smith, directeur général d’Air France-KLM, doit détailler l’ampleur des réductions de personnels, mais aussi les grandes lignes du plan de restructuration sur trois ans de la compagnie à l’occasion d’un comité social et économique central (CSEC) extraordinaire, prévu le 3 juillet.",Inquiétude chez Air France avant l’annonce de coupes dans les effectifs,https://www.lemonde.fr/economie/article/2020/06/27/inquietude-chez-air-france-avant-l-annonce-de-coupes-dans-les-effectifs_6044381_3234.html
,Publié le 27 juin 2020 à 04h38 - Mis à jour le 27 juin 2020 à 07h14, Médias ,"Révolution à Springfield : les producteurs des Simpsons, série animée mondialement connue, ont annoncé, vendredi 26 juin, qu’ils ne feraient désormais plus appel à des acteurs blancs pour doubler les personnages appartenant à des minorités ethniques.","Dans les « Simpsons », les acteurs blancs ne doubleront plus les personnages de couleur",https://www.lemonde.fr/pixels/article/2020/06/27/dans-les-simpsons-les-acteurs-blancs-ne-doubleront-plus-les-personnages-de-couleur_6044359_4408996.html
,,,"De mémoire de clubbeur quadra, dance floor et gastronomie ont rarement fait bon ménage. On engloutissait un kebab avant ou après sa soirée. Car, sur place, l’offre indigeste oscillait entre frites molles et tapas douteuses. Certains lieux de la nuit ont néanmoins aujourd’hui commencé une métamorphose, accélérée par la crise due au coronavirus : si on ne peut plus frétiller du bassin, on peut au moins faire frémir ses papilles.",« On se dirige vers des nuits pour gens sages » : quand les night-clubs dressent les tables,https://www.lemonde.fr/m-styles/article/2020/06/28/on-se-dirige-vers-des-nuits-pour-gens-sages-quand-les-night-clubs-dressent-les-tables_6044485_4497319.html
Thomas Doustaly,"Publié hier à 00h19, mis à jour hier à 14h49", Voyage ,LA LISTE DE LA MATINALE,Cinq virées qui coulent de source,https://www.lemonde.fr/m-styles/article/2020/06/28/cinq-virees-qui-coulent-de-source_6044426_4497319.html
Stéphane Foucart,Publié le 26 juin 2020 à 11h31, Pollutions ,"Bien qu’utilisés dans les systèmes d’assainissement de l’eau potable ou dans de nombreux cosmétiques, les sels d’aluminium ne sont guère au centre de l’attention médiatique. Ils n’en sont pas moins au cœur d’une dispute inédite. Passée inaperçue en pleine pandémie de Covid-19, celle-ci n’a été rendue publique que mi-juin dans le Journal officiel de l’Union européenne : la France a introduit, fin février, un recours contre l’Agence européenne des produits chimiques (ECHA) devant le Tribunal de l’Union européenne. C’est la première fois qu’un Etat membre attaque, devant la haute juridiction basée au Luxembourg, l’intégrité d’une décision rendue par une agence d’expertise communautaire.",Sels d’aluminium : la France attaque l’Agence européenne des produits chimiques,https://www.lemonde.fr/planete/article/2020/06/26/sels-d-aluminium-la-france-attaque-l-agence-europeenne-des-produits-chimiques_6044270_3244.html
,Publié le 12 juin 2020 à 12h00,,"100 g de champignons de Paris, 20 g d’algues miyeok séchées (wakamé), 1,5 litre d’eau, 1 c. à s. d’huile de sésame grillé, 1 c. à c. d’huile d’olive, 2 c. à s. de sauce soja claire, 1 gousse d’ail pelée et hachée, 2 c. à s. de ciboule hachée (facultatif), sel, poivre.",,https://www.lemonde.fr/les-recettes-du-monde/article/2020/06/12/la-soupe-aux-algues-ou-miyeok-guk-la-recette-de-luna-kyung_6042625_5324493.html
Camille Labro,Publié le 26 juin 2020 à 12h00, Recettes faciles ,"2 ou 3 aubergines (selon la taille, pour environ 600 g), 2 branches de céleri, 1 ou 2 c. à s. de raisins secs (optionnel), 1 oignon, 1 poignée d’olives vertes ou noires dénoyautées, 1 petite poignée de câpres (dessalées), 6 c. à s. de vinaigre de vin, 1 c. à s. de sucre, 100 g de purée de tomates fraîches, 1 petite poignée de pignons de pin, légèrement torréfiés, huile végétale, 2 c. à s. d’huile d’olive vierge extra, sel, poivre.",La caponata : la recette de Claude Fischler,https://www.lemonde.fr/les-recettes-du-monde/article/2020/06/26/la-caponata-la-recette-de-claude-fischler_6044275_5324493.html
Nicolas Chapuis,"Publié le 27 juin 2020 à 03h43, mis à jour hier à 11h29", Police ,"Il est facile de les repérer aux éclats de lumière bleutée dans la nuit et au bruit caractéristique de la sirène deux tons. Depuis près de trois semaines, la même scène se répète tous les soirs, un peu partout en France : des dizaines de policiers se rassemblent, allument les gyrophares et protestent quelques minutes contre le « lâchage » par le pouvoir dont ils estiment faire l’objet.",Le ministère de l’intérieur passif face au mouvement de colère des policiers qui s’amplifie,https://www.lemonde.fr/societe/article/2020/06/27/policiers-le-ministere-de-l-interieur-passif-face-a-un-mouvement-de-colere-qui-s-amplifie_6044358_3224.html
Nathalie Stey,Publié le 26 juin 2020 à 06h10 - Mis à jour le 26 juin 2020 à 11h10, Strasbourg ,"Aux polémiques sur une « bétonisation » de Strasbourg, difficile à assumer pour des candidats issus de la même majorité municipale, a succédé, alors que le second tour de l’élection se tiendra dimanche 28 juin, une course à la relance économique. Mais derrière un même terme se cachent des réalités différentes.","Municipales : à Strasbourg, les trois candidats adaptent leurs programmes à la crise",https://www.lemonde.fr/politique/article/2020/06/26/municipales-a-strasbourg-les-trois-candidats-adaptent-leurs-programmes-a-la-crise_6044233_823448.html
Pascale Krémer,Publié le 18 juin 2020 à 02h01 - Mis à jour le 18 juin 2020 à 10h50, Nos vies confinées ,"Jusqu’au milieu de la cour, la documentaliste charrie les livres dans une brouette. La prof de français y tient un atelier théâtre sur pelouse. Son collègue de maths trace des figures géométriques au sol, tout près de l’endroit où Emma, élève de 5e, a calligraphié à la craie : « L’idée d’une recette de tarte aux fraises vole dans ma tête, l’ennui est parti en courant. » Délicat reliquat d’une initiation poétique en plein air. Et quand vient l’heure de la cantine, c’est pique-nique au petit bois du dessus. Le collège Louis-Hémon, de Pleyben (Finistère), a ouvert grandes ses portes.",Coronavirus : les activités de plein air plébiscitées par les Français,https://www.lemonde.fr/m-le-mag/article/2020/06/18/extension-du-domaine-du-plein-air_6043225_4500055.html
Patricia Jolly,Publié le 27 juin 2020 à 05h06 - Mis à jour le 27 juin 2020 à 10h12, Climat ,"L’Etat a pris son temps pour rédiger sa réponse et, sans surprise, elle ulcère les quatre ONG qui l’ont assigné, au printemps 2019, devant le tribunal administratif de Paris pour son inaction alléguée face aux changements climatiques.",Changement climatique : l’Etat répond aux associations de « L’affaire du siècle »,https://www.lemonde.fr/planete/article/2020/06/27/changement-climatique-l-etat-repond-aux-associations-de-l-affaire-du-siecle_6044362_3244.html
,Publié le 26 juin 2020 à 11h15 - Mis à jour le 26 juin 2020 à 15h39, Municipales 2020 : enjeux et résultats ,"Editorial du « Monde ». Son nom est universellement célèbre, ses contours extrêmement flous. De quoi parle-t-on quand on prononce le nom de Paris ? Des vingt arrondissements (2,2 millions d’habitants) ceinturés par le boulevard périphérique ? De la zone densément peuplée incluant la petite couronne, ce territoire dénommé « Métropole du Grand Paris » (MGP) depuis 2016, où vivent 7,2 millions de citadins ? Ou de la vaste région Ile-de-France, qui, avec ses confins ruraux, compte 12 millions de personnes ?",,https://www.lemonde.fr/idees/article/2020/06/26/apres-les-municipales-l-indispensable-chantier-du-grand-paris_6044267_3232.html
Stéphanie Marteau,Publié le 26 juin 2020 à 09h55 - Mis à jour le 26 juin 2020 à 14h52, Municipales 2020 : tous nos articles ,"47,81 % des voix. Au premier tour des élections ­municipales, et bien que la droite s’y soit présentée éparpillée façon puzzle, l’avocat Francis Szpiner (LR), 66 ans, s’est taillé une confortable avance sur la candidate macroniste dans le 16e arrondissement de Paris. Une circonscription sur mesure, cossue, peuplée de professions libérales, léguée, en quelque sorte, à Szpiner par le très droitier maire sortant, Claude Goasguen, emporté en mai par le Covid-19.","Maître Szpiner, au nom du droit et de la droite",https://www.lemonde.fr/m-le-mag/article/2020/06/26/maitre-szpiner-au-nom-du-droit-et-de-la-droite_6044243_4500055.html
Clara Georges,Publié le 26 juin 2020 à 14h08 - Mis à jour le 27 juin 2020 à 20h29, Déconfinement ,"Devinette : qu’est-ce qui a l’odeur du bureau, les meubles du bureau, l’aspect du bureau, mais qui n’est pas le bureau ?","« On fait comme si de rien n’était alors que tout a changé » : pour les employés, le bureau n’est plus ce qu’il était",https://www.lemonde.fr/m-perso/article/2020/06/26/on-fait-comme-si-de-rien-n-etait-alors-que-tout-a-change-des-salaries-racontent-leur-retour-au-bureau_6044298_4497916.html
Rahma Adjadj,Publié le 19 juin 2020 à 15h30 - Mis à jour le 24 juin 2020 à 12h18, Masters et Mastères spécialisés ,"En pleine crise sanitaire, Quentin, étudiant en master en « management des organisations médicales » à l’université de Bordeaux, était en stage à la direction d’un Ehpad. Un baptême du feu « hyper formateur », confie-t-il, au téléphone. « Cela nous a donné l’occasion d’appliquer de nouvelles formes de management, plus participatives. » Quentin aimerait poursuivre dans cette voie : la crise a renforcé ses convictions et son sentiment d’être « utile pour la société ».","Chez les étudiants, la santé suscite de nouvelles vocations",https://www.lemonde.fr/campus/article/2020/06/19/chez-les-etudiants-la-sante-publique-suscite-de-nouvelles-vocations_6043473_4401467.html
,Publié hier à 18h49, Police et justice ,"Le tribunal administratif de Bastia a reconnu la responsabilité de l’Etat dans la mort d’un homme tué par un policier hors service, estimant que son arme aurait dû lui être retirée.",La justice reconnaît la responsabilité de l’Etat dans la mort d’un homme tué par un policier à Bastia,https://www.lemonde.fr/societe/article/2020/06/28/la-justice-reconnait-la-responsabilite-de-l-etat-dans-la-mort-d-un-homme-tue-par-un-policier-a-bastia_6044470_3224.html
Perrine Mouterde,Publié le 25 juin 2020 à 21h05 - Mis à jour le 26 juin 2020 à 07h19, Énergies fossiles ,"Le bâtiment devait être construit entre les salles de cours et le restaurant, il sera finalement érigé environ 200 mètres plus à l’est, entre les terrains de tennis et de football. Le conseil d’administration de Polytechnique a validé, jeudi 25 juin, l’implantation d’un centre d’innovation et de recherche de Total à proximité de l’Ecole, sur le plateau de Saclay (Essonne). En raison de la mobilisation contre ce projet, l’emplacement prévu a toutefois été modifié pour que l’immeuble soit situé sur une parcelle de terrain appartenant à l’établissement public d’aménagement (EPA) Paris-Saclay, et non plus à l’école militaire.",Le conseil d’administration de Polytechnique valide un projet de centre de recherche de Total,https://www.lemonde.fr/energies/article/2020/06/25/le-conseil-d-administration-de-total-valide-un-projet-de-centre-de-recherche-pres-de-polytechnique_6044205_1653054.html
,,,"Il est à Paris, au sommet d’une HLM, un lieu caché où, depuis un demi-siècle, les plus grands chanteurs, les meilleurs chefs d’orchestre du monde font pèlerinage avant chaque nouvelle création de Mozart, Debussy ou Ravel. Là, dans un vaste atelier transformé en salon de musique, une très vieille fée décrypte, avec eux, les arcanes des partitions. On y accède par un vestibule tendu de velours vert, fermé par un lourd rideau, comme les coulisses d’un théâtre. Passé le rideau, la magie commence. Entre icônes dorées et bibelots précieux, Irène Aïtoff, assise derrière son vénérable piano comme un petit bouddha centenaire, fait des miracles, mine de rien.","Il était une fois… Les secrets de la « veuve Mozart », qui dirigeait les plus grands chanteurs et chefs d’orchestre",https://www.lemonde.fr/archives/article/1998/12/29/les-secrets-de-la-veuve-mozart_3687238_1819218.html
Marie Godfrain,"Publié le 26 juin 2020 à 15h00, mis à jour à 00h27", Architecture ,"Quand Angie Delattre, responsable du département « prestige » de l’agence immobilière cannoise Michaël Zingraf, prend les clés du Palais Bulles pour le faire visiter à un client potentiel, c’est jour de fête. Cela doit arriver deux à trois fois par an depuis sa mise en vente, en 2013… Posté sur les hauteurs de Théoule-sur-Mer (Alpes-Maritimes), à quelques kilomètres de Cannes, ce bien est à la fois le plus atypique et le plus onéreux du catalogue de l’agence.",Les maisons-bulles sortent de leur sphère,https://www.lemonde.fr/m-le-mag/article/2020/06/26/les-maisons-bulles-sortent-de-leur-sphere_6044307_4500055.html
Cécile Bouanchaud,Publié le 26 juin 2020 à 16h24 - Mis à jour le 27 juin 2020 à 14h24,,"Manifestations contre les violences policières, mission d’information parlementaire sur le racisme, rapport du Défenseur des droits sur la discrimination, proposition de loi contre le système de l’entre-soi dans la haute fonction publique… La question du racisme s’est invitée dans le débat public depuis plusieurs semaines. Mais comment définir cette notion complexe ?","« Plutôt que d’essayer de définir le racisme, il faut regarder comment il se construit »",https://www.lemonde.fr/societe/article/2020/06/26/plutot-que-d-essayer-de-definir-le-racisme-il-faut-regarder-comment-il-se-construit_6044314_3224.html
Gary Dagorn,"Publié le 26 juin 2020 à 18h13, mis à jour hier à 06h52", Coronavirus et pandémie de Covid-19 ,"Alors que l’on s’interroge sur le risque de rebond de l’épidémie de Covid-19, le R0 est l’une des valeurs les plus surveillées en France et à l’étranger. Ce chiffre, qui est l’un des principaux indicateurs utilisés par les épidémiologistes, doit être interprété avec précaution.","Qu’est-ce que le « R0 », le taux de reproduction du virus ?",https://www.lemonde.fr/les-decodeurs/article/2020/06/26/qu-est-ce-que-le-r0-le-taux-de-reproduction-du-virus_6044327_4355770.html
,Publié le 26 juin 2020 à 12h26 - Mis à jour le 26 juin 2020 à 12h27, Zoologie ,"En observant des dauphins de Shark Bay en Australie, une équipe d’éthologues a découvert l’utilisation d’une nouvelle technique de chasse, consistant à acculer la proie dans un coquillage géant et à vider ensuite celui-ci dans leur gueule. Ainsi que l’explique cette vidéo proposée en partenariat avec Le blob, l’extra-média, les chercheurs se sont aussi aperçus que, contrairement à la chasse à l’éponge que les mères enseignent à leurs filles, les cétacés apprenaient cette technique simplement en observant leur pairs. Si ce mode de transmission est commun chez les grands singes, c’est la première fois qu’il est détecté chez des cétacés. L’étude décrivant ces résultats a été publiée le 25 juin dans Current Biology.",Comment des dauphins australiens se transmettent une étonnante technique de chasse,https://www.lemonde.fr/sciences/video/2020/06/26/comment-des-dauphins-australiens-se-transmettent-une-etonnante-technique-de-chasse_6044280_1650684.html
Mattea Battaglia,Publié le 24 juin 2020 à 06h16 - Mis à jour le 24 juin 2020 à 13h51, Bac ,"En cette fin d’année scolaire bousculée par la crise sanitaire, alors qu’écoliers et collégiens ont repris le chemin de l’école, le retour en cours des lycéens continue de se faire au compte-gouttes. Et les élèves de terminale sont privés du « rituel » vers lequel convergent, d’ordinaire, tous les regards à la fin du mois de juin : le baccalauréat.",Baccalauréat « option Covid » : la « fabrique des notes » en question,https://www.lemonde.fr/societe/article/2020/06/24/baccalaureat-option-covid-la-fabrique-des-notes-pose-question_6043967_3224.html
Harry Bellet,Publié le 26 juin 2020 à 08h00, Arts ,"Il se représente souvent, par le dessin ou la peinture, le visage assez allongé, de trois quarts, le crâne dégarni, de grosses lunettes rondes et une pipe au bec. Des photographies le montrent toujours impeccablement vêtu, en costume et portant cravate, que ce soit en ville ou dans l’atelier (à la campagne aussi, où, jeune homme, il se présente sur une photo ainsi accoutré peignant en plein milieu d’une prairie), comme il sied au notaire qu’il a failli devenir. Marcel Gromaire (1892-1971) a, physiquement, de faux airs de Mondrian. De Matisse à Kandinsky, les peintres les plus révolutionnaires ont aimé avoir des allures de bourgeois.",Exposition : la fascinante exubérance de Marcel Gromaire à Roubaix,https://www.lemonde.fr/culture/article/2020/06/26/exposition-la-fascinante-exuberance-de-marcel-gromaire-a-roubaix_6044237_3246.html
Fabienne Darge,Publié le 23 juin 2020 à 08h30, Scènes ,"Sur le Vieux-Port, ce grand paquebot qu’est le Théâtre de la Criée a pris un nouveau départ. Fermée depuis le 17 mars, comme toutes les salles de spectacle de France, l’institution a rouvert ses portes le 8 juin, et pour tout l’été. Avec un public particulier, composé de toute la palette, riche et variée, de la jeunesse défavorisée de la cité phocéenne.","A Marseille, le Théâtre de la Criée sur le pont cet été",https://www.lemonde.fr/culture/article/2020/06/23/a-marseille-le-theatre-de-la-criee-sur-le-pont-cet-ete_6043837_3246.html
,,,"Yann Couvreur fait partie de cette nouvelle génération de pâtissiers qui proposent des gâteaux moins sucrés, réalisés avec des fruits de saison et sans colorants chimiques. Après des années passées dans les palaces, il s’est lancé à son compte en 2016 avec succès : déjà trois boutiques à Paris, un service de livraison dans toute la France et, depuis la crise du Covid-19, des maxi-goûters (baptisés Confin’Box et au prix de 49 euros) à se faire livrer chaque semaine, constamment en rupture de stock. Qu’importe ! Le pâtissier de 36 ans a élaboré pour Le Monde un goûter de très haut niveau.",Cinq recettes de goûter par Yann Couvreur,https://www.lemonde.fr/m-styles/article/2020/06/02/cinq-recettes-de-gouter-par-yann-couvreur_6041522_4497319.html
Audrey Garric,Publié le 24 juin 2020 à 22h26 - Mis à jour le 27 juin 2020 à 05h53, Climat ,"Cent cinquante propositions pour relever l’ambition climatique de la France, mais à quel coût ? L’Institut de l’économie pour le climat (I4CE) s’est livré à un premier chiffrage de l’impact financier des mesures de la convention citoyenne pour le climat, remises dimanche 21 juin au gouvernement. Il en ressort un coût net d’environ 6 milliards d’euros par an pour les finances publiques.",Combien coûteraient les propositions de la convention citoyenne pour le climat ?,https://www.lemonde.fr/planete/article/2020/06/24/combien-couteraient-les-propositions-de-la-convention-citoyenne-pour-le-climat_6044071_3244.html
Emmanuelle Jardonnet,Publié le 19 juin 2020 à 17h27 - Mis à jour le 24 juin 2020 à 06h04, Arts ,"Il y a un an, les artistes Ella et Pitr peignaient à Paris une fresque hors norme, sur près de 2,5 hectares… pourtant restée invisible. Seuls les visiteurs du Parc des expositions de la porte de Versailles ont pu contempler, depuis une terrasse, leur vieille dame rêvassant devant la circulation du périph’ : un personnage de leur série des « Géants » cabossés par la vie et coincés au milieu de l’agitation urbaine. On les retrouve, aujourd’hui, affairés à peindre un mur tout ce qu’il y a de plus classique dans ses dimensions en plein cœur du 8e arrondissement parisien. Leur rapport épidermique au street art se serait-il dissous dans le confinement ?",Ella et Pitr prennent le street art à revers,https://www.lemonde.fr/culture/article/2020/06/19/ella-amp-pitr-prennent-le-street-art-a-rebrousse-poil_6043489_3246.html
,,,"« Menhebak », (« Nous t’aimons »). Ce slogan ingénu, imprimé sur de gigantesques portraits de Bachar Al-Assad, recouvre les murs de Damas. Nous sommes en mai 2007, à quelques semaines du référendum qui va accorder un deuxième mandat au président syrien avec un score de satrape africain (97,6 %). La campagne conçue en vue de cette échéance veut donner l’impression que le pays tout entier est tombé sous le charme de ce quadragénaire (il est né en 1965) à l’allure moderne et flegmatique. Son père, Hafez Al-Assad, commandeur sec et impénétrable, régnait par la peur. Le fils, lui, veut se faire aimer.","Dallas à Damas, le clan Assad se déchire",https://www.lemonde.fr/international/article/2020/06/26/syrie-damas-son-univers-impitoyable_6044291_3210.html
Frédéric Bobin,Publié le 22 juin 2020 à 00h43 - Mis à jour le 26 juin 2020 à 18h19, Libye ,"Le parallèle effraie de plus en plus en haut lieu, à Paris et ailleurs. L’escalade des ingérences étrangères en Libye, duo turco-russe en tête sur fond d’une noria de groupes mercenaires, rapprocherait dangereusement la Libye des abysses syriens.","En Libye, un condominium turco-russe aux portes méridionales de l’Europe",https://www.lemonde.fr/afrique/article/2020/06/22/en-libye-un-condominium-turco-russe-aux-portes-meridionales-de-l-europe_6043669_3212.html
Aurélie Fardeau,Publié le 26 juin 2020 à 06h00,,"C’est un phénomène encore méconnu. « La population mondiale des seniors devrait doubler pour atteindre plus de deux milliards en 2050 », indique Credit Suisse pour évoquer le vieillissement démographique dans son dernier rapport sur les « supertrends », ou « mégatendances ». Derrière ce terme se cachent des mouvements internationaux à très long terme qui bouleversent nos sociétés. « Ce sont des tendances séculaires, des lames de fond qui impactent notre économie », résume Estelle Ménard, responsable adjointe de la gestion thématique chez CPR AM.",Investir en fonction des « mégatendances »,https://www.lemonde.fr/argent/article/2020/06/26/investir-en-fonction-des-megatendances_6044229_1657007.html
