article_author,article_date,article_location,body,title,urlLouis Imbert,Publié le 27 juin 2020 à 10h59 - Mis à jour le 27 juin 2020 à 11h53, Israël/Palestine ,"La bannière barre l’entrée de la maison des Khader, au pied des collines de Naplouse, dans le nord de la Cisjordanie. Un peu à l’écart du centre-bourg d’Hawara, deux portraits d’hommes souriants se détachent sur le plastique blanc : Jalal, 34 ans, et Kamal, 31 ans, assassinés le 31 mai, avec leur oncle, Jihad, 38 ans. « C’est une peine impossible à décrire », soupire Rehab Sharaf, leur mère, entourée des cinq enfants de Jalal dans le salon. Ce printemps, Kamal s’est introduit dans l’une des bâtisses abandonnées d’une famille palestinienne des environs. Les propriétaires se sont offusqués, l’affaire s’est envenimée et un matin, une dizaine de jeunes hommes armés de fusils automatiques ont pris son frère Jalal. Ils l’ont abattu avec son oncle puis ont assassiné Kamal, arrivé peu après sur les lieux. « Ils étaient prêts à tuer tout le monde », pleure la tante, Rameh Khader.","En Cisjordanie, la rupture de la coopération sécuritaire avec Israël crée des tensions",https://www.lemonde.fr/international/article/2020/06/27/en-cisjordanie-la-rupture-de-la-cooperation-securitaire-avec-israel-cree-des-tensions_6044392_3210.html
,"Publié hier à 13h53, mis à jour hier à 18h31", Municipales 2020 : tous nos articles ,"Les instituts de sondage, très visibles avant les élections pour mesurer les tendances et effectuer des projections, ont aussi un rôle très important le soir des scrutins. Entre 18 heures et 20 heures, au moment où les derniers bureaux de vote ferment, puis tout au long de la soirée, ce sont eux qui réalisent les estimations des résultats. Ces calculs ne se font pas à partir de sondages à la sortie des urnes mais sur la base des premiers dépouillements. Quand ces estimations sont suffisamment consolidées, elles sont révélées par les médias. Un moment sensible, surtout lorsque le résultat est serré – comme lors de l’élection présidentielle de 2002, où Jean-Marie Le Pen (Front national) s’était qualifié au second tour avec 16,86 % des voix, obligeant Lionel Jospin (Parti socialiste) à prendre sa retraite politique (16,18 %).",Elections municipales 2020 : comment sont réalisées les estimations de vote ?,https://www.lemonde.fr/politique/article/2020/06/28/comment-sont-realisees-les-estimations-de-vote-les-soirs-d-elections_6044456_823448.html
,Publié le 26 juin 2020 à 14h06 - Mis à jour le 26 juin 2020 à 18h52, Ligue 1 ,"Coup d’envoi le week-end du 22 et 23 août. Coup de sifflet final le 23 mai 2021. Dans l’intervalle, 38 journées à disputer. Le calendrier de la saison 2020-2021 du championnat de Ligue 1 a été dévoilé par la Ligue de football professionnel (LFP), vendredi 26 juin.","Football : la Ligue 1 reprendra le 22 août, avec 20 équipes",https://www.lemonde.fr/sport/article/2020/06/26/football-la-ligue-1-reprendra-a-20-equipes_6044297_3242.html
Pierre Gervasoni,Publié le 26 juin 2020 à 19h22, Musiques ,"Qui n’a jamais entendu l’appel insistant du Minaeptacta gringi ou l’ululement plaintif de la Phola reicha ignore tout de la capacité avant-gardiste du règne animal. A condition que ce dernier soit investi par le compositeur Mauro Lanza (né en 1975) et son complice Andrea Valle (né en 1974), concepteur d’objets sonores… et d’un bestiaire imaginaire. Un trio à cordes, des appareils pris dans la vie courante (radios-réveils, couteaux électriques, tourne-disques), un ordinateur, et le tour est joué ! Impossible de résister à l’incantation du Taleus photothodecae.","Avec le compositeur Mauro Lanza, l’électroacoustique au naturel",https://www.lemonde.fr/culture/article/2020/06/26/avec-le-compositeur-mauro-lanza-l-electroacoustique-au-naturel_6044336_3246.html
Maryline Baumard,Publié le 24 juin 2020 à 12h24, Tunisie ,"Elu président de la Tunisie le 13 octobre 2019 avec 72,71 % des voix, Kaïs Saïed a créé une surprise de taille dans le paysage politique tunisien. Candidat indépendant, ce juriste constitutionnaliste de 61 ans a mené campagne sans grands moyens, notamment auprès de la jeunesse, lasse des promesses non tenues de la révolution de 2011. Sa première visite en France a notamment été consacrée au conflit libyen, sujet d’inquiétude majeur pour cette jeune démocratie encore fragile.",Kaïs Saïed : « La Tunisie n’acceptera jamais la partition de la Libye »,https://www.lemonde.fr/afrique/article/2020/06/24/kais-saied-la-tunisie-n-acceptera-jamais-la-partition-de-la-libye_6044014_3212.html
Cécile Ducourtieux,"Publié le 27 juin 2020 à 09h31, mis à jour hier à 06h08", Entreprises ,"En l’espace de quelques jours, des entreprises et institutions britanniques de premier plan ont reconnu leurs liens passés avec l’esclavage, présenté leurs excuses à la communauté noire du Royaume-Uni et ont même, pour certaines, promis des réparations financières. Ces prises de position inédites sont une conséquence directe du mouvement Black Lives Matter (BLM), qui a déclenché un vigoureux débat national. Nombre d’activistes et d’historiens réclament que soit reconnu le caractère raciste de l’ex-Empire britannique et revendiquent une « décolonisation » de l’espace public, après la mise à bas de la statue de l’esclavagiste Edward Colston, à Bristol, début juin.","« Ce fut une période terrible » : au Royaume-Uni, des entreprises demandent pardon pour leurs liens avec l’esclavage",https://www.lemonde.fr/economie/article/2020/06/27/ce-fut-une-periode-terrible-au-royaume-uni-des-entreprises-demandent-pardon-pour-leurs-liens-avec-l-esclavage_6044378_3234.html
Isabelle Rey-Lefebvre,Publié aujourd’hui à 00h29, Immobilier ,"Elle est bien calme, l’esplanade du quartier d’affaires de la Défense, dans les Hauts-de-Seine, jeudi 25 juin au matin, à l’heure de pointe où d’ordinaire s’y bousculent cadres et employés pressés de rejoindre l’une des 70 tours accueillant 3 600 entreprises, surtout de grands groupes internationaux. D’habitude, 85 % des 180 000 salariés du quartier arrivent par les transports en commun, trams, Transilien, RER, métros, bus, tous saturés comme l’est le réseau routier et son aride boulevard circulaire.",Le télétravail bouscule l’immobilier de bureaux,https://www.lemonde.fr/economie/article/2020/06/29/le-teletravail-bouscule-l-immobilier-de-bureaux_6044488_3234.html
,"Publié hier à 20h09, mis à jour à 03h34", Municipales 2020 : enjeux et résultats ,"Le second tour des élections municipales aurait dû avoir lieu le 22 mars dernier. Il s’est finalement achevé plus de trois mois après, ce 28 juin, à 20 heures. Au total, 4 820 communes (soit 15 % du total) étaient concernées par ce scrutin, qui s’est tenu dans des conditions particulières entre la distanciation physique, le port du masque et la présence de gel hydroalcoolique dans les bureaux de vote.",Elections municipales 2020 : les principaux résultats du second tour par commune,https://www.lemonde.fr/politique/article/2020/06/28/elections-municipales-2020-les-principaux-resultats-du-second-tour-par-commune_6044473_823448.html
Mathilde Gérard,Publié le 26 juin 2020 à 00h11 - Mis à jour le 26 juin 2020 à 11h16, Nutrition ,"McDo Happy Meal, Nutella, Kinder Bueno : ces produits alimentaires figurent dans le top 10 de ceux ayant fait l’objet des plus gros investissements publicitaires en 2018, selon une étude de Santé publique France (SPF), publiée mercredi 24 juin. Alors que de nombreux travaux scientifiques ont montré l’impact du marketing sur les choix de consommation des enfants, l’agence de sécurité sanitaire a mesuré l’exposition des mineurs aux publicités alimentaires.",La moitié des pubs alimentaires vues par les enfants sont pour des produits mauvais pour la santé,https://www.lemonde.fr/planete/article/2020/06/26/la-moitie-des-publicites-alimentaires-vues-par-les-enfants-concerne-des-produits-gras-sucres-et-sales_6044210_3244.html
,,,Un article mis à jour toutes les 24 heures,Coronavirus : visualisez les pays qui ont « aplati la courbe » de l’épidémie et ceux qui n’y sont pas encore parvenus,https://www.lemonde.fr/les-decodeurs/article/2020/03/27/coronavirus-visualisez-les-pays-qui-ont-aplati-la-courbe-de-l-infection-et-ceux-qui-n-y-sont-pas-encore-parvenus_6034627_4355770.html
Hervé Morin,Publié le 25 juin 2020 à 03h30 - Mis à jour le 26 juin 2020 à 09h54, Coronavirus et pandémie de Covid-19 ,"Il est entré dans l’arène comme une rockstar. Sans sa blouse blanche, un masque couvrant la moitié de son visage, encadré par de longs cheveux blonds. Suivi par une nuée de caméras et de photographes, le professeur Didier Raoult, devenu l’une des personnalités « politiques » préférées des Français, était attendu, mercredi 24 juin, dans une certaine effervescence par les députés de la commission d’enquête parlementaire chargée d’étudier la généalogie de la crise sanitaire et les éventuelles failles de la réponse française à l’épidémie.",Coronavirus : la longue prescription du professeur Didier Raoult aux députés,https://www.lemonde.fr/planete/article/2020/06/25/covid-19-la-longue-prescription-du-professeur-didier-raoult-aux-deputes_6044086_3244.html
Isabelle Mandraud,"Publié le 27 juin 2020 à 06h30, mis à jour hier à 17h40", Pologne ,"La réalisatrice polonaise, dont le film L’Ombre de Staline, consacré à la famine organisée en Ukraine dans les années 1930, est sorti le 22 juin en France, est l’une des voix les plus critiques envers le parti Droit et justice (PiS) au pouvoir depuis 2015 en Pologne, où les entorses à l’Etat de droit se sont multipliées. A la veille du premier tour de l’élection présidentielle organisé le 28 juin, elle soutient résolument le candidat de l’opposition démocrate, Rafal Trzaskowski.",Agnieszka Holland : « C’est peut-être la dernière chance pour la démocratie polonaise avant longtemps »,https://www.lemonde.fr/idees/article/2020/06/27/agnieszka-holland-c-est-peut-etre-la-derniere-chance-pour-la-democratie-polonaise-avant-longtemps_6044371_3232.html
,"Publié hier à 18h30, mis à jour hier à 23h55", Santé ,"10 000 pas et plus. Les chiffres sont inquiétants. La sédentarité (le temps d’éveil passé assis ou couché, avec des dépenses énergétiques très faibles) chez les enfants et adolescents de 6 à 18 ans a fortement progressé pendant le confinement. Le temps d’écran a atteint trente heures par semaine, soit plus de quatre heures par jour (contre vingt heures par semaine avant le confinement), selon une étude réalisée par Harris Interactive pour l’association Assurance Prévention réalisée en deux temps, fin février et du 28 mai au 4 juin. Activité également sédentaire, la lecture de livres a progressé, mais de seulement une heure, avec 3,3 heures par semaine.",,https://www.lemonde.fr/sciences/article/2020/06/28/trop-d-ecran-moins-d-activite-physique-les-enfants-et-adolescents-ont-moins-bouge-pendant-le-confinement_6044469_1650684.html
Simon Piel,"Publié hier à 14h31, mis à jour à 00h50", Politique ,"Les juges d’instruction du pôle financier du tribunal de Nanterre ont signifié, vendredi 26 juin, une nouvelle mise en examen à l’une des personnes apparaissant dans l’information judiciaire visant le député La République en marche (LRM) Thierry Solère, ouverte en février 2019 pour fraude fiscale, détournement de fonds publics, trafic d’influence, abus de biens sociaux et financement illicite de dépenses électorales.",Une nouvelle mise en examen dans l’affaire Thierry Solère,https://www.lemonde.fr/police-justice/article/2020/06/28/une-nouvelle-mise-en-examen-dans-l-affaire-solere_6044458_1653578.html
Pierre Breteau,Publié le 27 avril 2020 à 17h07 - Mis à jour le 26 juin 2020 à 17h15, En un graphique ,"Cet article, initialement publié le 27 avril 2020, a été mis à jour avec les données les plus récentes de l'Insee (le 26 juin avec les chiffres du 15 juin 2020).",Coronavirus : un pic très net de mortalité en France enregistré en mars et avril,https://www.lemonde.fr/les-decodeurs/article/2020/04/27/coronavirus-un-pic-tres-net-de-mortalite-en-france-depuis-le-1er-mars-par-rapport-aux-vingt-dernieres-annees_6037912_4355770.html
Les Décodeurs,"Publié le 14 février 2020 à 17h10, mis à jour hier à 22h43", Municipales 2020 : tous nos articles ,"La maire socialiste, Anne Hidalgo, l'emporte à Paris avec environ 49 % des voix selon des estimations de l'institut Ipsos. Elle devancerait largement la candidate des Républicains, Rachida Dati, et celle de La République en marche, Agnès Buzyn. ",Municipales 2020 : les résultats des municipales à Paris,https://www.lemonde.fr/les-decodeurs/article/2020/02/14/municipales-a-paris-qui-sont-les-candidats-en-lice-dans-la-capitale_6029617_4355770.html
Emilie Grangeray,Publié le 18 juin 2020 à 10h11 - Mis à jour le 18 juin 2020 à 10h27, Télévisions & Radio ,"Depuis le temps qu’il prend soin de nous, Ali Rebeihi méritait bien un portrait. Au plus fort du confinement, quelque 2,3 millions d’auditeurs étaient branchés sur « Grand bien vous fasse ! », émission quotidienne chaque matin sur France Inter, dans laquelle se mêlent questions sociétales et recommandations culturelles, avec une grande place consacrée aux interactions avec les auditeurs. Au début du confinement, l’audience sur cette tranche a été telle que d’une heure, l’émission est passée à deux, pour aborder des sujets aussi variés que le sommeil « confiné », comment écouter Bach pouvait nous aider à surmonter la période, ou encore quels films de Truffaut regarder sur Netflix.","Ali Rebeihi, l’animateur radio qui a accompagné la vie des auditeurs pendant le confinement",https://www.lemonde.fr/culture/article/2020/06/18/ali-rebeihi-animateur-la-democratie-est-le-terrain-de-jeu-ou-l-on-peut-discuter-et-meme-se-disputer-mais-ensemble_6043261_3246.html
Nathaniel Herzberg,Publié le 19 juin 2020 à 14h23 - Mis à jour le 22 juin 2020 à 15h59, Physique ,"Une particule peut en cacher une autre. La collaboration internationale Xenon1T (163 chercheurs, venus de 11 pays, dont la France), qui traque depuis des années la matière noire sous le tunnel du Gran Sasso, en Italie, a annoncé, mercredi 17 juin, dans un article en preprint sur le site arXiv, qu’elle pourrait avoir détecté des particules jusqu’ici insaisissables. Pas les WIMP, ces superparticules dont beaucoup de physiciens pensent qu’elles pourraient constituer la base de la matière noire, mais des axions, de minuscules corpuscules, jusqu’ici cantonnés aux équations des théoriciens.",Physique des particules : des détections déroutantes en Italie,https://www.lemonde.fr/sciences/article/2020/06/19/physique-des-particules-des-detections-deroutantes-en-italie_6043460_1650684.html
,,,"Chaque soir, Estelle* a son petit rituel. Quand certains préfèrent terminer leur journée par un verre en terrasse, la jeune étudiante toulousaine allume son ordinateur et lance Overwatch, un FPS (first-person shooter, jeu de tir à la première personne) populaire et édité par Blizzard Entertainment. Deux équipes s’y affrontent, notamment en capturant des objectifs et en s’éliminant. Pour « remporter la game », la coopération est déterminante.","« J’ai arrêté de jouer pendant deux mois, car j’étais au bout de moi » : les joueuses en ligne restent confrontées au sexisme",https://www.lemonde.fr/pixels/article/2020/06/25/les-joueuses-restent-confrontees-au-sexisme-et-a-la-violence-dans-les-jeux-multijoueur-en-ligne_6044129_4408996.html
,Publié hier à 06h00, Famille ,Question à un expert,Comment puis-je optimiser la transmission de mon patrimoine à mes neveux et nièces ?,https://www.lemonde.fr/argent/article/2020/06/28/comment-puis-je-optimiser-la-transmission-de-mon-patrimoine-a-mes-neveux-et-nieces_6044441_1657007.html
,,,"Ce n’est pas en compulsant la collection complète des Guides du routard, dont il est le secrétaire général, que Gavin’s Clemente Ruiz a eu un coup de foudre pour le pays d’Auge. Mais tout simplement parce qu’il y est né il y a quarante-deux ans, et que sa terre natale est restée celle de cœur. Lui qui a parcouru la planète, alors qu’il n’était encore que simple rédacteur stagiaire au Routard, continue de revendiquer ses racines : « Je suis pontépiscopien, né à Lisieux, la ville de Sainte-Thérèse », dit-il non sans humour.","Un lieu, une rencontre : le pays d’Auge de Gavin’s Clemente Ruiz",https://www.lemonde.fr/m-styles/article/2020/06/19/un-lieu-une-rencontre-le-pays-d-auge-de-gavin-s-clemente-ruiz_6043384_4497319.html
Stéphanie Le Bars,"Publié aujourd’hui à 01h59, mis à jour à 02h59", Municipales 2020 : enjeux et résultats ,"A l’unisson, les journaux européens relèvent la « vague verte », qui a balayé la France après la victoire des écologistes dans plusieurs grandes villes de France, dimanche 28 juin, lors des élections municipales. Strasbourg, Bordeaux, Lyon, Tours, Besançon, Poitiers, Annecy, Marseille : « les candidats écologistes ont remporté des victoires majeures » à travers le pays, note The Guardian. Ce deuxième tour des élections, reporté pour cause de coronavirus, inflige aussi un « revers majeur » au mouvement du président Emmanuel Macron, La République en marche. « Le parti n’est pas parvenu à s’implanter localement, quatre ans après sa création », constate le journal britannique. La victoire d’Anne Hidalgo à Paris est aussi présentée comme une victoire de l’écologie : « la socialiste, soutenue par Europe Ecologie-Les Verts et les communistes, a fait de la lutte contre le changement climatique et la pollution les éléments clés de son programme ».","Municipales en France : pour la presse européenne, une « vague verte », qui fragilise Macron",https://www.lemonde.fr/politique/article/2020/06/29/municipales-en-france-pour-la-presse-europeenne-une-vague-verte-qui-fragilise-macron_6044490_823448.html
,,,"Pour nous, Français, il est incarné par Laurent Blanc, celui par qui « la lumière est venue » contre le Paraguay en 1998 dans un huitième de finale de Coupe du monde aussi fermé que mal embarqué. Mais rendons à Oliver ce qui revient à Oliver. Celui qui est entré dans l’histoire du football en inscrivant le premier « but en or », c’est l’attaquant allemand Oliver Bierhoff, le 30 juin 1996 à Londres, dans le vénérable stade de Wembley, ses deux tours et son style victorien.",Retour sur... Allemagne - République tchèque 1996 : et Bierhoff transforma le but en or,https://www.lemonde.fr/sport/article/2020/06/28/retour-sur-allemagne-republique-tcheque-1996-et-bierhoff-transforma-le-but-en-or_6044437_3242.html
,,,"Le Père Bernard est sûr d’avoir Dieu à ses côtés. Et la loi républicaine aussi. Du moins pour l’instant. Mais il ne peut en dire autant des simples mortels de Saint-Pierre-de-Colombier, en Ardèche, 413 âmes, ou des communes environnantes qui longent le cours de la Bourges. Depuis des mois, les projets immobiliers de la congrégation religieuse qu’il dirige divisent les habitants. Il y a ceux qui approuvent. Il y a ceux qui s’en lavent les mains. Et il y a ceux, de plus en plus nombreux ou visibles, qui maudissent la Famille missionnaire de Notre-Dame (FMND) pour ce qu’elle fait bâtir : un complexe pour l’accueil des pèlerins qui étendra son hectare et demi de béton de chaque côté de la rivière.",Querelle de chapelle à Saint-Pierre-de-Colombier,https://www.lemonde.fr/m-le-mag/article/2020/06/23/a-saint-pierre-de-colombier-notre-dame-de-la-discorde_6043836_4500055.html
,"Publié hier à 17h23, mis à jour hier à 18h01", Europe ,"La Finlande, la Suède et la Norvège ont relevé ces derniers jours des niveaux inhabituels, mais faibles, de radioactivité. Une hausse inoffensive pour l’homme qui, selon un institut néerlandais, trouverait sa source en Russie occidentale, tandis qu’une ONG française a écarté une piste menant en Lettonie.",Faible hausse de radioactivité d’origine inconnue relevée en Europe du Nord,https://www.lemonde.fr/planete/article/2020/06/28/faible-hausse-de-radioactivite-d-origine-inconnue-relevee-en-europe-du-nord_6044465_3244.html
Cécile Chambraud,"Publié hier à 16h50, mis à jour hier à 18h07", Catholicisme ,"Il emportera de Lyon une nouvelle croix pectorale, une gravure de la cathédrale Saint-Jean et le souvenir d’une descente de la nef sous les applaudissements. Le cardinal Philippe Barbarin, archevêque de Lyon pendant dix-sept ans, a célébré, dimanche 28 juin, une dernière messe en la primatiale des Gaules, à Lyon. Il a renoncé à cette charge épiscopale le 6 mars, après plus de quatre années scandées par les révélations, les enquêtes et les procès du scandale de pédophilie lié à Bernard Preynat, prêtre défroqué condamné pour agressions sexuelles sur de jeunes scouts, dont il était l’aumônier dans les années 1970 et 1980.",La dernière messe du cardinal Barbarin à Lyon,https://www.lemonde.fr/societe/article/2020/06/28/la-derniere-messe-du-cardinal-barbarin-a-lyon_6044462_3224.html
Laurence Caramel,Publié le 26 juin 2020 à 10h01 - Mis à jour le 26 juin 2020 à 10h15, Madagascar ,"Pour ne rien manquer de l’actualité africaine, inscrivez-vous à la newsletter du « Monde Afrique » depuis ce lien. Chaque samedi à 6 heures, retrouvez une semaine d’actualité et de débats traitée par la rédaction du « Monde Afrique ».","Soixante ans après l’indépendance, Madagascar se cherche toujours un avenir",https://www.lemonde.fr/afrique/article/2020/06/26/soixante-ans-apres-l-independance-madagascar-se-cherche-toujours-un-avenir_6044244_3212.html
,Publié le 26 juin 2020 à 07h00, Musiques ,"Benjamin Biolay est le nouvel invité du podcast Le Goût de M proposé par M Le magazine du Monde, à l’occasion de la sortie de son nouvel album « Grand Prix ». Le chanteur a répondu depuis son appartement du 6e arrondissement parisien aux questions de la journaliste et productrice Géraldine Sarratia. Benjamin Biolay y évoque son enfance à Villefranche-sur-Saône, l’odeur des merguez aux abords du stade de foot et celle des gitanes filtre qu’il achetait pour sa mère ; son départ pour Lyon et ses années au conservatoire. Il décrit la passion de son père pour la musique romantique allemande ; ses premières compositions à l’âge de 14/15 ans ; son amour alors de la pop anglaise des Beatles à The Smiths. Et revient sur sa rencontre décisive avec Hubert Mounier, le chanteur de L’Affaire Louis’ Trio. Il dit son admiration pour les crooners de Sinatra à Jim Morrison, son amour pour Marilyn Monroe ou l’écrivain Scott Fitzgerald. Aborde son rapport à l’Amérique, sa fascination pour les premiers romans de Bret Easton Ellis ou les disques des Strokes ; son statut de chanteur, sa relation à la nuit et pourquoi il a décidé de maintenir la sortie de son premier single en plein confinement. Enfin, se proclamant imperméable au goût des autres, il chante les louanges de Frank Ocean et de Chet Baker, « l’esthète absolu » et dénonce l’obscénité d’une partie de la politique menée par le gouvernement.","Benjamin Biolay : « Penser à l’héritage qu’on va laisser, c’est le meilleur moyen de rater sa vie »",https://www.lemonde.fr/podcasts/article/2020/06/26/benjamin-biolay-penser-a-l-heritage-qu-on-va-laisser-c-est-le-meilleur-moyen-de-rater-sa-vie_6044236_5463015.html
,Publié hier à 23h53, Musiques ,LA LISTE DE LA MATINALE,"Thousand, Blanco White, Brel… Retour sur nos albums coups de cœur",https://www.lemonde.fr/culture/article/2020/06/28/thousand-blanco-white-brel-retour-sur-nos-albums-coups-de-c-ur_6044483_3246.html
Jean-Pierre Stroobants,"Publié hier à 21h01, mis à jour hier à 22h27", Coronavirus et pandémie de Covid-19 ,"Il aura fallu beaucoup de temps pour l’ébaucher, il en faudra, encore, pour qu’elle soit enfin approuvée : la liste des pays dont les ressortissants pourront, dès le mercredi 1er juillet, en principe, entrer sur le territoire de l’Union européenne, est décidément un casse-tête.",Coronavirus : les Vingt-Sept invités à se prononcer sur l’ouverture des frontières extérieures de l’Union,https://www.lemonde.fr/international/article/2020/06/28/coronavirus-les-vingt-sept-invites-a-se-prononcer-sur-l-ouverture-des-frontieres-exterieures-de-l-union_6044475_3210.html
Frédéric Saliba,"Publié hier à 22h01, mis à jour à 01h12", Mexique ,"Le blindage de sa camionnette n’a pas résisté à la violence de l’assaut. Le chef de la police de Mexico, Omar Garcia Harfuch, a réchappé de peu, vendredi 26 juin, à une spectaculaire embuscade qui a fait trois morts dans un quartier huppé de la capitale mexicaine. Blessé, M. Garcia Harfuch a accusé, sur son compte Twitter, juste avant de passer au bloc opératoire, le cartel Jalisco Nueva Generacion (CJNG) d’avoir commandité son assassinat. Cet attentat mafieux, inédit à Mexico, prend des airs de déclaration de guerre contre l’Etat.","Au Mexique, un cartel de la drogue déclare la guerre à l’Etat",https://www.lemonde.fr/international/article/2020/06/28/au-mexique-un-cartel-de-la-droque-declare-la-guerre-a-l-etat_6044479_3210.html
